{
  "session_id": "abcd1234",
  "session_root": "/tmp/am2-session-abcd1234",
  "created_at": "2026-08-15T16:20:00Z",
  "resources": [
    {
      "type": "temp_dir",
      "id": "/tmp/am2-session-abcd1234/workspace",
      "owner_session": "abcd1234",
      "ownership_proof": "created by session abcd1234",
      "retention": "disposable"
    },
    {
      "type": "docker_container",
      "id": "am2-session-abcd1234-relay",
      "owner_session": "abcd1234",
      "ownership_proof": "label com.am2.session=abcd1234",
      "retention": "disposable"
    }
  ]
}
